Codec: VIA VT1708S
Address: 0
AFG Function Id: 0x1 (unsol 0)
Vendor Id: 0x11060397
Subsystem Id: 0x10438415
Revision Id: 0x100000
No Modem Function Group found
Default PCM:
    rates [0x0]:
    bits [0x0]:
    formats [0x0]:
Default Amp-In caps: N/A
Default Amp-Out caps: N/A
State of AFG node 0x01:
  Power states:  D0 D1 D2 D3
  Power: setting=D0, actual=D0
GPIO: io=1, o=0, i=0, unsolicited=1, wake=0
  IO[0]: enable=0, dir=0, wake=0, sticky=0, data=0, unsol=0
Node 0x10 [Audio Output] wcaps 0x41d: Stereo Amp-Out
  Control: name="Front Playback Volume", index=0, device=0
    ControlAmp: chs=3, dir=Out, idx=0, ofs=0
  Device: name="VT1708S Analog", type="Audio", device=0
  Amp-Out caps: ofs=0x2a, nsteps=0x2a, stepsize=0x05, mute=0
  Amp-Out vals:  [0x1c 0x1c]
  Converter: stream=0, channel=0
  PCM:
    rates [0x5e0]: 44100 48000 88200 96000 192000
    bits [0xe]: 16 20 24
    formats [0x1]: PCM
  Power states:  D0 D1 D2 D3
  Power: setting=D0, actual=D0
Node 0x11 [Audio Output] wcaps 0x41d: Stereo Amp-Out
  Control: name="Surround Playback Volume", index=0, device=0
    ControlAmp: chs=3, dir=Out, idx=0, ofs=0
  Amp-Out caps: ofs=0x2a, nsteps=0x2a, stepsize=0x05, mute=0
  Amp-Out vals:  [0x1c 0x1c]
  Converter: stream=0, channel=0
  PCM:
    rates [0x5e0]: 44100 48000 88200 96000 192000
    bits [0xe]: 16 20 24
    formats [0x1]: PCM
  Power states:  D0 D1 D2 D3
  Power: setting=D0, actual=D0
Node 0x12 [Audio Output] wcaps 0x611: Stereo Digital
  Control: name="IEC958 Playback Con Mask", index=0, device=0
  Control: name="IEC958 Playback Pro Mask", index=0, device=0
  Control: name="IEC958 Playback Default", index=0, device=0
  Control: name="IEC958 Playback Switch", index=0, device=0
  Control: name="IEC958 Default PCM Playback Switch", index=0, device=0
  Device: name="VT1708S Digital", type="HDMI", device=3
  Converter: stream=0, channel=0
  Digital: Enabled
  Digital category: 0x0
  IEC Coding Type: 0x0
  PCM:
    rates [0x5e0]: 44100 48000 88200 96000 192000
    bits [0xe]: 16 20 24
    formats [0x1]: PCM
  Power states:  D0 D1 D2 D3
  Power: setting=D0, actual=D0
Node 0x13 [Audio Input] wcaps 0x10051b: Stereo Amp-In
  Control: name="Capture Volume", index=0, device=0
    ControlAmp: chs=3, dir=In, idx=0, ofs=0
  Control: name="Capture Switch", index=0, device=0
    ControlAmp: chs=3, dir=In, idx=0, ofs=0
  Device: name="VT1708S Analog", type="Audio", device=0
  Amp-In caps: ofs=0x0b, nsteps=0x1f, stepsize=0x05, mute=1
  Amp-In vals:  [0x13 0x13]
  Converter: stream=0, channel=0
  SDI-Select: 0
  PCM:
    rates [0x560]: 44100 48000 96000 192000
    bits [0xe]: 16 20 24
    formats [0x1]: PCM
  Power states:  D0 D1 D2 D3
  Power: setting=D0, actual=D0
  Connection: 1
     0x17
Node 0x14 [Audio Input] wcaps 0x10051b: Stereo Amp-In
  Amp-In caps: ofs=0x0b, nsteps=0x1f, stepsize=0x05, mute=1
  Amp-In vals:  [0x8b 0x8b]
  Converter: stream=0, channel=0
  SDI-Select: 0
  PCM:
    rates [0x560]: 44100 48000 96000 192000
    bits [0xe]: 16 20 24
    formats [0x1]: PCM
  Power states:  D0 D1 D2 D3
  Power: setting=D0, actual=D0
  Connection: 1
     0x1e
Node 0x15 [Audio Output] wcaps 0x611: Stereo Digital
  Converter: stream=0, channel=0
  Digital:
  Digital category: 0x0
  IEC Coding Type: 0x0
  PCM:
    rates [0x5e0]: 44100 48000 88200 96000 192000
    bits [0xe]: 16 20 24
    formats [0x1]: PCM
  Power states:  D0 D1 D2 D3
  Power: setting=D0, actual=D0
Node 0x16 [Audio Mixer] wcaps 0x20050b: Stereo Amp-In
  Control: name="Rear Mic Playback Volume", index=0, device=0
    ControlAmp: chs=3, dir=In, idx=2, ofs=0
  Control: name="Rear Mic Playback Switch", index=0, device=0
    ControlAmp: chs=3, dir=In, idx=2, ofs=0
  Control: name="Front Mic Playback Volume", index=0, device=0
    ControlAmp: chs=3, dir=In, idx=4, ofs=0
  Control: name="Front Mic Playback Switch", index=0, device=0
    ControlAmp: chs=3, dir=In, idx=4, ofs=0
  Control: name="Line Playback Volume", index=0, device=0
    ControlAmp: chs=3, dir=In, idx=3, ofs=0
  Control: name="Line Playback Switch", index=0, device=0
    ControlAmp: chs=3, dir=In, idx=3, ofs=0
  Amp-In caps: ofs=0x17, nsteps=0x1f, stepsize=0x05, mute=1
  Amp-In vals:  [0x17 0x17] [0x80 0x80] [0x80 0x80] [0x80 0x80] [0x80 0x80] [0x80 0x80] [0x80 0x80]
  Power states:  D0 D1 D2 D3
  Power: setting=D0, actual=D0
  Connection: 7
     0x10 0x1f 0x1a 0x1b 0x1e 0x1d 0x25
Node 0x17 [Audio Selector] wcaps 0x300501: Stereo
  Power states:  D0 D1 D2 D3
  Power: setting=D0, actual=D0
  Connection: 6
     0x1f 0x1a* 0x1b 0x1e 0x1d 0x16
Node 0x18 [Audio Selector] wcaps 0x30050d: Stereo Amp-Out
  Control: name="Surround Playback Switch", index=0, device=0
    ControlAmp: chs=3, dir=Out, idx=0, ofs=0
  Amp-Out caps: ofs=0x00, nsteps=0x00, stepsize=0x00, mute=1
  Amp-Out vals:  [0x00 0x00]
  Power states:  D0 D1 D2 D3
  Power: setting=D0, actual=D0
  Connection: 1
     0x11
Node 0x19 [Pin Complex] wcaps 0x400581: Stereo
  Pincap 0x00000014: OUT Detect
  Pin Default 0x410110f0: [N/A] Line Out at Ext Rear
    Conn = 1/8, Color = Black
    DefAssociation = 0xf, Sequence = 0x0
  Pin-ctls: 0x00:
  Unsolicited: tag=00, enabled=0
  Power states:  D0 D1 D2 D3
  Power: setting=D0, actual=D0
  Connection: 1
     0x18
Node 0x1a [Pin Complex] wcaps 0x400581: Stereo
  Control: name="Rear Mic Boost Volume", index=0, device=0
    ControlAmp: chs=3, dir=In, idx=0, ofs=0
  Pincap 0x00002334: IN OUT Detect
    Vref caps: HIZ 50 100
  Pin Default 0x01a19036: [Jack] Mic at Ext Rear
    Conn = 1/8, Color = Pink
    DefAssociation = 0x3, Sequence = 0x6
  Pin-ctls: 0x21: IN VREF_50
  Unsolicited: tag=03, enabled=1
  Power states:  D0 D1 D2 D3
  Power: setting=D0, actual=D0
  Connection: 1
     0x26
Node 0x1b [Pin Complex] wcaps 0x400581: Stereo
  Pincap 0x00002334: IN OUT Detect
    Vref caps: HIZ 50 100
  Pin Default 0x0181303e: [Jack] Line In at Ext Rear
    Conn = 1/8, Color = Blue
    DefAssociation = 0x3, Sequence = 0xe
  Pin-ctls: 0x20: IN VREF_HIZ
  Unsolicited: tag=05, enabled=1
  Power states:  D0 D1 D2 D3
  Power: setting=D0, actual=D0
  Connection: 1
     0x18
Node 0x1c [Pin Complex] wcaps 0x40058d: Stereo Amp-Out
  Control: name="Front Playback Switch", index=0, device=0
    ControlAmp: chs=3, dir=Out, idx=0, ofs=0
  Amp-Out caps: ofs=0x00, nsteps=0x00, stepsize=0x00, mute=1
  Amp-Out vals:  [0x00 0x00]
  Pincap 0x0001001c: OUT HP EAPD Detect
  EAPD 0x2: EAPD
  Pin Default 0x01014010: [Jack] Line Out at Ext Rear
    Conn = 1/8, Color = Green
    DefAssociation = 0x1, Sequence = 0x0
  Pin-ctls: 0x40: OUT
  Unsolicited: tag=01, enabled=1
  Power states:  D0 D1 D2 D3
  Power: setting=D0, actual=D0
  Connection: 1
     0x16
Node 0x1d [Pin Complex] wcaps 0x40058d: Stereo Amp-Out
  Control: name="Headphone Playback Switch", index=0, device=0
    ControlAmp: chs=3, dir=Out, idx=0, ofs=0
  Amp-Out caps: ofs=0x00, nsteps=0x00, stepsize=0x00, mute=1
  Amp-Out vals:  [0x00 0x00]
  Pincap 0x0000233c: IN OUT HP Detect
    Vref caps: HIZ 50 100
  Pin Default 0x0221401f: [Jack] HP Out at Ext Front
    Conn = 1/8, Color = Green
    DefAssociation = 0x1, Sequence = 0xf
  Pin-ctls: 0xc0: OUT HP VREF_HIZ
  Unsolicited: tag=02, enabled=1
  Power states:  D0 D1 D2 D3
  Power: setting=D0, actual=D0
  Connection: 2
     0x16 0x25*
Node 0x1e [Pin Complex] wcaps 0x40058d: Stereo Amp-Out
  Control: name="Front Mic Boost Volume", index=0, device=0
    ControlAmp: chs=3, dir=In, idx=0, ofs=0
  Amp-Out caps: ofs=0x00, nsteps=0x00, stepsize=0x00, mute=1
  Amp-Out vals:  [0x80 0x80]
  Pincap 0x0000233c: IN OUT HP Detect
    Vref caps: HIZ 50 100
  Pin Default 0x02a19037: [Jack] Mic at Ext Front
    Conn = 1/8, Color = Pink
    DefAssociation = 0x3, Sequence = 0x7
  Pin-ctls: 0x21: IN VREF_50
  Unsolicited: tag=04, enabled=1
  Power states:  D0 D1 D2 D3
  Power: setting=D0, actual=D0
  Connection: 2
     0x16* 0x25
Node 0x1f [Pin Complex] wcaps 0x400401: Stereo
  Pincap 0x00000020: IN
  Pin Default 0x503701f0: [N/A] CD at Int N/A
    Conn = Analog, Color = Unknown
    DefAssociation = 0xf, Sequence = 0x0
    Misc = NO_PRESENCE
  Pin-ctls: 0x00:
  Power states:  D0 D1 D2 D3
  Power: setting=D0, actual=D0
Node 0x20 [Pin Complex] wcaps 0x400701: Stereo Digital
  Pincap 0x00000010: OUT
  Pin Default 0x185600f0: [Jack] Digital Out at Int HDMI
    Conn = Digital, Color = Unknown
    DefAssociation = 0xf, Sequence = 0x0
  Pin-ctls: 0x40: OUT
  Power states:  D0 D1 D2 D3
  Power: setting=D0, actual=D0
  Connection: 1
     0x12
Node 0x21 [Pin Complex] wcaps 0x400701: Stereo Digital
  Pincap 0x00000010: OUT
  Pin Default 0x474411f0: [N/A] SPDIF Out at Ext Rear Panel
    Conn = RCA, Color = Black
    DefAssociation = 0xf, Sequence = 0x0
    Misc = NO_PRESENCE
  Pin-ctls: 0x00:
  Power states:  D0 D1 D2 D3
  Power: setting=D0, actual=D0
  Connection: 1
     0x15
Node 0x22 [Pin Complex] wcaps 0x400581: Stereo
  Pincap 0x00000014: OUT Detect
  Pin Default 0x410160f0: [N/A] Line Out at Ext Rear
    Conn = 1/8, Color = Orange
    DefAssociation = 0xf, Sequence = 0x0
  Pin-ctls: 0x00:
  Unsolicited: tag=00, enabled=0
  Power states:  D0 D1 D2 D3
  Power: setting=D0, actual=D0
  Connection: 1
     0x26
Node 0x23 [Pin Complex] wcaps 0x400581: Stereo
  Pincap 0x00000014: OUT Detect
  Pin Default 0x410120f0: [N/A] Line Out at Ext Rear
    Conn = 1/8, Color = Grey
    DefAssociation = 0xf, Sequence = 0x0
  Pin-ctls: 0x00:
  Unsolicited: tag=00, enabled=0
  Power states:  D0 D1 D2 D3
  Power: setting=D0, actual=D0
  Connection: 1
     0x27
Node 0x24 [Audio Output] wcaps 0x41d: Stereo Amp-Out
  Control: name="Center Playback Volume", index=0, device=0
    ControlAmp: chs=1, dir=Out, idx=0, ofs=0
  Control: name="LFE Playback Volume", index=0, device=0
    ControlAmp: chs=2, dir=Out, idx=0, ofs=0
  Amp-Out caps: ofs=0x2a, nsteps=0x2a, stepsize=0x05, mute=0
  Amp-Out vals:  [0x1c 0x1c]
  Converter: stream=0, channel=0
  PCM:
    rates [0x5e0]: 44100 48000 88200 96000 192000
    bits [0xe]: 16 20 24
    formats [0x1]: PCM
  Power states:  D0 D1 D2 D3
  Power: setting=D0, actual=D0
Node 0x25 [Audio Output] wcaps 0x41d: Stereo Amp-Out
  Control: name="Headphone Playback Volume", index=0, device=0
    ControlAmp: chs=3, dir=Out, idx=0, ofs=0
  Device: name="VT1708S Alt Analog", type="Audio", device=2
  Amp-Out caps: ofs=0x2a, nsteps=0x2a, stepsize=0x05, mute=0
  Amp-Out vals:  [0x1c 0x1c]
  Converter: stream=0, channel=0
  PCM:
    rates [0x5e0]: 44100 48000 88200 96000 192000
    bits [0xe]: 16 20 24
    formats [0x1]: PCM
  Power states:  D0 D1 D2 D3
  Power: setting=D0, actual=D0
Node 0x26 [Audio Selector] wcaps 0x30050d: Stereo Amp-Out
  Control: name="Center Playback Switch", index=0, device=0
    ControlAmp: chs=1, dir=Out, idx=0, ofs=0
  Control: name="LFE Playback Switch", index=0, device=0
    ControlAmp: chs=2, dir=Out, idx=0, ofs=0
  Amp-Out caps: ofs=0x00, nsteps=0x00, stepsize=0x00, mute=1
  Amp-Out vals:  [0x00 0x00]
  Power states:  D0 D1 D2 D3
  Power: setting=D0, actual=D0
  Connection: 1
     0x24
Node 0x27 [Audio Selector] wcaps 0x30050d: Stereo Amp-Out
  Amp-Out caps: ofs=0x00, nsteps=0x00, stepsize=0x00, mute=1
  Amp-Out vals:  [0x80 0x80]
  Power states:  D0 D1 D2 D3
  Power: setting=D0, actual=D0
  Connection: 1
     0x25
