CPU: ID 0x20655, Processor Type 0x0, Family 0x6, Model 0x25, Stepping 0x5
Northbridge: 8086:0040 (unknown)
Southbridge: 8086:3b06 (H55)
IGD: 8086:0042 (Intel(R) HD Graphics)

============= GPIOS =============

GPIOBASE = 0x0500 (IO)

gpiobase+0x0000: 0xffffa9c3 (GPIO_USE_SEL)
gpiobase+0x0000: 0xf96ba1ff (GPIO_USE_SEL) DEFAULT
gpiobase+0x0000: 0x0694083c (GPIO_USE_SEL) DIFF
gpiobase+0x0004: 0x5200e600 (GP_IO_SEL)
gpiobase+0x0004: 0xf6ff6eff (GP_IO_SEL) DEFAULT
gpiobase+0x0004: 0xa4ff88ff (GP_IO_SEL) DIFF
gpiobase+0x0008: 0x00000000 (RESERVED)
gpiobase+0x000c: 0xfa00e63c (GP_LVL)
gpiobase+0x000c: 0x02fe0100 (GP_LVL) DEFAULT
gpiobase+0x000c: 0xf8fee73c (GP_LVL) DIFF
gpiobase+0x0010: 0x00000000 (RESERVED)
gpiobase+0x0014: 0x00000000 (RESERVED)
gpiobase+0x0018: 0x00000000 (GPO_BLINK)
gpiobase+0x0018: 0x00040000 (GPO_BLINK) DEFAULT
gpiobase+0x0018: 0x00040000 (GPO_BLINK) DIFF
gpiobase+0x001c: 0x00000000 (GP_SER_BLINK)
gpiobase+0x0020: 0x00080000 (GP_SB_CMDSTS)
gpiobase+0x0024: 0x00000000 (GP_SB_DATA)
gpiobase+0x0028: 0x0000     (GPI_NMI_EN)
gpiobase+0x002a: 0x0000     (GPI_NMI_STS)
gpiobase+0x002c: 0x0000a000 (GPI_INV)
gpiobase+0x002c: 0x00000000 (GPI_INV) DEFAULT
gpiobase+0x002c: 0x0000a000 (GPI_INV) DIFF
gpiobase+0x0030: 0x17f3f0ff (GPIO_USE_SEL2)
gpiobase+0x0030: 0x020300ff (GPIO_USE_SEL2) DEFAULT
gpiobase+0x0030: 0x15f0f000 (GPIO_USE_SEL2) DIFF
gpiobase+0x0034: 0x0a043f08 (GP_IO_SEL2)
gpiobase+0x0034: 0x1f57fff4 (GP_IO_SEL2) DEFAULT
gpiobase+0x0034: 0x1553c0fc (GP_IO_SEL2) DIFF
gpiobase+0x0038: 0xea0c3f20 (GP_LVL2)
gpiobase+0x0038: 0xa4aa0003 (GP_LVL2) DEFAULT
gpiobase+0x0038: 0x4ea63f23 (GP_LVL2) DIFF
gpiobase+0x003c: 0x00000000 (RESERVED)
gpiobase+0x0040: 0x00000100 (GPIO_USE_SEL3)
gpiobase+0x0044: 0x00000e00 (GP_IO_SEL3)
gpiobase+0x0044: 0x00000f00 (GP_IO_SEL3) DEFAULT
gpiobase+0x0044: 0x00000100 (GP_IO_SEL3) DIFF
gpiobase+0x0048: 0x00000e0f (GP_LVL3)
gpiobase+0x0048: 0x00000000 (GP_LVL3) DEFAULT
gpiobase+0x0048: 0x00000e0f (GP_LVL3) DIFF
gpiobase+0x004c: 0x00000000 (RESERVED)
gpiobase+0x0050: 0x00000000 (RESERVED)
gpiobase+0x0054: 0x00000000 (RESERVED)
gpiobase+0x0058: 0x00000000 (RESERVED)
gpiobase+0x005c: 0x00000000 (RESERVED)
gpiobase+0x0060: 0x01000000 (GP_RST_SEL1)
gpiobase+0x0064: 0x00000000 (GP_RST_SEL2)
gpiobase+0x0068: 0x00000000 (GP_RST_SEL3)
gpiobase+0x006c: 0x00000000 (RESERVED)
gpiobase+0x0070: 0x00000000 (RESERVED)
gpiobase+0x0074: 0x00000000 (RESERVED)
gpiobase+0x0078: 0x00000000 (RESERVED)
gpiobase+0x007c: 0x00000000 (RESERVED)



============= RCBA ==============

Error mapping physical memory 0xfed1c000[0x4000]
Try booting with iomem=relaxed.
